{
  "$schema": "../packages/validation/schemas/rules.schema.json",
  "policyVersion": 1,
  "description": "Machine-readable ethics/security/privacy/quality/compliance rules enforced across every tool in this repository. Human rationale lives in docs/POLICY.md. Each rule has a stable diagnostic code; the validation package (packages/validation) implements the checks. 'enforcement: automated' rules are checked by code; 'enforcement: attested' rules are confirmed via SECURITY-CHECKLIST.md and reviewed. Critical (blocking) rules cannot be suppressed locally.",
  "severities": ["error", "warning", "info"],
  "categories": {
    "structure": "Required files, native manifest schema, naming",
    "version": "Single authoritative version source and cross-manifest consistency",
    "disclosure": "Honest disclosure of capabilities, permissions, side effects, limitations",
    "security": "Secure defaults, secrets, injection, path safety, install boundaries",
    "privacy": "Data minimization; no undisclosed collection/transmission",
    "ethics": "No deceptive, harmful, or unauthorized behavior",
    "quality": "Meaningful validation/tests; no placeholders or false success",
    "compliance": "Conformance to the current official platform specification",
    "packaging": "Deterministic, minimal, integrity-checked artifacts",
    "install": "Scoped, safe, reversible installation"
  },
  "rules": [
    { "code": "STRUCT001", "category": "structure", "severity": "error", "blocking": true, "enforcement": "automated", "appliesTo": ["*"], "summary": "Tool has a manifest/tool.json with required fields (name, type, targets, version, license).", "remediation": "Add manifest/tool.json with the required metadata block." },
    { "code": "STRUCT002", "category": "structure", "severity": "error", "blocking": true, "enforcement": "automated", "appliesTo": ["*"], "summary": "Tool name is kebab-case, unique, no spaces or special characters.", "remediation": "Rename the tool to kebab-case." },
    { "code": "STRUCT003", "category": "structure", "severity": "error", "blocking": true, "enforcement": "automated", "appliesTo": ["plugin"], "summary": "Claude plugin has .claude-plugin/plugin.json with a valid name; components live at plugin root, not inside .claude-plugin/.", "remediation": "Move components to plugin root; keep only plugin.json in .claude-plugin/." },
    { "code": "STRUCT004", "category": "structure", "severity": "error", "blocking": true, "enforcement": "automated", "appliesTo": ["skill"], "summary": "Skill has a SKILL.md with name and description frontmatter.", "remediation": "Add SKILL.md with required frontmatter." },
    { "code": "STRUCT005", "category": "structure", "severity": "error", "blocking": true, "enforcement": "automated", "appliesTo": ["rule"], "summary": "Cursor rule is a .mdc file with valid frontmatter (description/globs/alwaysApply).", "remediation": "Provide a .mdc rule with valid frontmatter." },
    { "code": "STRUCT006", "category": "structure", "severity": "error", "blocking": true, "enforcement": "automated", "appliesTo": ["*"], "summary": "Placement matches targets: single-host tools live under tools/<host>/, multi-host under tools/portable/.", "remediation": "Move the tool to the correct directory for its declared targets." },
    { "code": "STRUCT007", "category": "structure", "severity": "error", "blocking": true, "enforcement": "automated", "appliesTo": ["*"], "summary": "Referenced files, scripts, and assets exist at the declared relative paths.", "remediation": "Fix or remove broken references." },
    { "code": "STRUCT008", "category": "structure", "severity": "error", "blocking": true, "enforcement": "automated", "appliesTo": ["plugin"], "summary": "No path traverses outside the plugin root (../); plugins are self-contained (Claude requirement).", "remediation": "Bundle the referenced content or use a plugin dependency instead of an external path." },

    { "code": "VER001", "category": "version", "severity": "error", "blocking": true, "enforcement": "automated", "appliesTo": ["*"], "summary": "Exactly one authoritative version source (package.json); native manifests are stamped from it, not hand-maintained.", "remediation": "Set the version only in package.json; let packaging stamp the native manifest." },
    { "code": "VER002", "category": "version", "severity": "error", "blocking": true, "enforcement": "automated", "appliesTo": ["*"], "summary": "Version is valid SemVer and consistent across all manifests.", "remediation": "Align the version across package.json and native manifests." },
    { "code": "VER003", "category": "version", "severity": "error", "blocking": true, "enforcement": "attested", "appliesTo": ["*"], "summary": "Breaking security/privacy/permission/compatibility changes are not shipped in a patch release.", "remediation": "Use a minor/major bump and document the breaking change." },

    { "code": "DISC001", "category": "disclosure", "severity": "error", "blocking": true, "enforcement": "automated", "appliesTo": ["*"], "summary": "Manifest declares capabilities: filesystem read/write, shell, network, git, external APIs, MCP, credentials, telemetry, remote content.", "remediation": "Fill in the capabilities/disclosure block in manifest/tool.json." },
    { "code": "DISC002", "category": "disclosure", "severity": "error", "blocking": true, "enforcement": "automated", "appliesTo": ["*"], "summary": "README documents purpose, limitations, supported platforms, required permissions, side effects, and destructive operations.", "remediation": "Complete the README disclosure sections." },
    { "code": "DISC003", "category": "disclosure", "severity": "error", "blocking": true, "enforcement": "automated", "appliesTo": ["*"], "summary": "No unsupported evidence-free labels (secure, safe, verified, validated, compatible, portable, tested, production-ready) without backing.", "remediation": "Remove or substantiate the claim." },
    { "code": "DISC004", "category": "disclosure", "severity": "error", "blocking": true, "enforcement": "attested", "appliesTo": ["*"], "summary": "A declared target host is only listed after its validator + fixture pass; no unverified compatibility claims.", "remediation": "Remove the target or add passing verification for it." },

    { "code": "SEC001", "category": "security", "severity": "error", "blocking": true, "enforcement": "automated", "appliesTo": ["*"], "summary": "No committed secrets, private keys, tokens, or .env files containing values.", "remediation": "Remove the secret and rotate it; use .env.example placeholders." },
    { "code": "SEC002", "category": "security", "severity": "error", "blocking": true, "enforcement": "automated", "appliesTo": ["*"], "summary": "No install-time remote code execution (e.g. curl|bash) from untrusted sources.", "remediation": "Vendor the content or require HTTPS + pinned version + integrity check + explicit user action." },
    { "code": "SEC003", "category": "security", "severity": "error", "blocking": true, "enforcement": "automated", "appliesTo": ["*"], "summary": "No unsafe shell construction or command injection; inputs are validated/quoted.", "remediation": "Quote variables, validate inputs, avoid eval." },
    { "code": "SEC004", "category": "security", "severity": "error", "blocking": true, "enforcement": "automated", "appliesTo": ["*"], "summary": "No path traversal or unsafe symlinks in tool content or package.", "remediation": "Constrain paths to the tool/package root." },
    { "code": "SEC005", "category": "security", "severity": "error", "blocking": true, "enforcement": "automated", "appliesTo": ["*"], "summary": "Portable paths only: use ${CLAUDE_PLUGIN_ROOT}/host variables, never hardcoded absolute or home paths.", "remediation": "Replace absolute/~ paths with the provided environment variables." },
    { "code": "SEC006", "category": "security", "severity": "error", "blocking": true, "enforcement": "automated", "appliesTo": ["*"], "summary": "install.sh/validate.sh detect the platform before touching the filesystem and write only to declared, scoped targets.", "remediation": "Source scripts/lib/detect-platform.sh and scope writes." },
    { "code": "SEC007", "category": "security", "severity": "error", "blocking": true, "enforcement": "attested", "appliesTo": ["*"], "summary": "Requests the minimum necessary permissions; no permission overreach inferred from category.", "remediation": "Declare and justify each permission explicitly." },

    { "code": "PRIV001", "category": "privacy", "severity": "error", "blocking": true, "enforcement": "attested", "appliesTo": ["*"], "summary": "Collects/reads/transmits only data required for the declared operation (data minimization).", "remediation": "Remove unnecessary data access; document what remains." },
    { "code": "PRIV002", "category": "privacy", "severity": "error", "blocking": true, "enforcement": "automated", "appliesTo": ["*"], "summary": "No sensitive content in logs, diagnostics, telemetry, handoff files, or release artifacts.", "remediation": "Redact sensitive fields; keep them out of outputs." },
    { "code": "PRIV003", "category": "privacy", "severity": "error", "blocking": true, "enforcement": "attested", "appliesTo": ["*"], "summary": "Any external transmission is intentional, documented, authorized, and minimal.", "remediation": "Document and gate the transmission, or remove it." },

    { "code": "ETH001", "category": "ethics", "severity": "error", "blocking": true, "enforcement": "attested", "appliesTo": ["*"], "summary": "Tool does not mislead users, hide side effects, fabricate evidence, exfiltrate data, weaken security, or conceal vulnerabilities.", "remediation": "Redesign the tool to comply; generation/validation fails otherwise." },